{"meta":{"edition":4,"publishedAt":"2026-09-11T12:04:00+02:00","cutoff":"11 september 2026 · 12:04 CEST","window":"9 september 2026 · 22:24 – 11 september 2026 · 12:04 CEST","label":"Weekeditie"},"headlines":[{"category":"AI-veiligheid","title":"Anthropic zegt vijf gevallen van potentieel gevaarlijk biologisch AI-gebruik te hebben geblokkeerd"},{"category":"Cybersecurity","title":"Anthropic koppelt Claude-misbruik aan Russische cyberoperaties en andere staatsgebonden activiteiten"},{"category":"Agenten","title":"OpenAI brengt een beheerde Agents API uit voor langlopende cloudagenten en subagenten"},{"category":"Bedrijfsdata","title":"OpenAI lanceert een Data agent die bedrijfsdata onderzoekt en interactieve dashboards bouwt"},{"category":"Financiële sector","title":"ChatGPT for Financial Services combineert Astra met ingebouwde financiële databronnen"},{"category":"Spraak-AI","title":"GPT-Live-1 brengt full-duplex spraak en onderbrekingen naar de OpenAI API"},{"category":"Zorg","title":"Britse AI-zorgcommissie adviseert continue levenscycluscontrole in plaats van eenmalige toelating"},{"category":"Chips","title":"Positron haalt 875 miljoen dollar op en waardeert de inference-chipuitdager op 5 miljard dollar"},{"category":"Geopolitiek","title":"Nieuwe Anthropic-claims scherpen het conflict over distillatie door Chinese AI-bedrijven verder aan"},{"category":"Werk","title":"De nieuwe productgolf verschuift enterprise-AI van losse assistentie naar uitvoerende workflows"}],"bigStory":{"section":"Het grote verhaal · Misbruik & biosecurity","title":"Anthropics misbruikrapport maakt de veiligheidsdiscussie concreter: AI raakt het laboratorium én de operatie","dek":"Anthropic zegt vijf gevallen te hebben geblokkeerd waarin wetenschappers Claude gebruikten voor biologisch onderzoek dat volgens het bedrijf potentieel relevant was voor biologische wapens. Onafhankelijke berichtgeving bevestigt de openbaarmaking, maar niet de intenties van de betrokken gebruikers.","readMinutes":12,"minute":["Vastgesteld: Reuters en AP berichten dat Anthropic op 10 september een nieuw misbruikrapport openbaar maakte met vijf bio-gerelateerde casussen.","Bedrijfsclaim: Anthropic stelt dat sommige activiteiten potentieel biologische-wapenontwikkeling konden ondersteunen; de intentie van de gebruikers is niet publiek vastgesteld.","Vastgesteld: het rapport beschrijft daarnaast cyber-, surveillance-, propaganda- en conventionele-wapenactiviteiten waarbij Claude volgens Anthropic werd misbruikt.","Analyse: de governancevraag verschuift van hypothetische modelcapaciteit naar detectie van intentie, accountgedrag en risicovolle werkstromen in werkelijk gebruik.","Voorspelling: aanbieders zullen strengere toegangslagen voor professionele biologie combineren met meer monitoring en informatie-uitwisseling met overheden."],"intro":"De belangrijkste verandering is niet dat een chatbot zelfstandig een biologisch wapen heeft gemaakt; daarvoor is geen publiek bewijs. Wel ontstaat een serie concrete gevallen waarin een frontiermodel onderdeel werd van risicovolle biologische werkstromen.","facts":["Reuters rapporteert dat Anthropic vijf gevallen identificeerde waarin wetenschappers Claude gebruikten voor biologisch onderzoek dat volgens het bedrijf mogelijk relevant was voor biologische wapens, waaronder werk rond vogelgriep.","AP beschrijft onder meer een casus rond een subsidieaanvraag voor gain-of-function-onderzoek naar chikungunya en benadrukt dat dual-use onderzoek zowel legitieme als gevaarlijke toepassingen kan hebben.","Anthropic had al eerder ASL-3-beschermingsmaatregelen voor CBRN-risico’s beschreven, waaronder classifiers, monitoring en toegangscontroles."],"analysis":["Veel biologische informatie is op zichzelf legitiem; risico ontstaat wanneer opeenvolgende verzoeken samen een gevaarlijke experimentele workflow vormen. Dat bevoordeelt monitoring op traject- en accountniveau boven simpele trefwoordblokkades.","De openbaarmaking is tegelijk bewijs en bedrijfsclaim. Dat Anthropic accounts blokkeerde en casussen rapporteerde is onafhankelijk gemeld; de onderliggende logs, attributie en volledige intentieanalyse zijn niet publiek controleerbaar.","Voor toezichthouders ontstaat een lastige grens: te strenge filters kunnen legitiem onderzoek hinderen, terwijl te losse toegang de expertise en tijd voor gevaarlijke experimenten kan verlagen."],"impact":"Biosecurity wordt een operationeel product- en toezichtsvraagstuk. Labs moeten aantonen hoe zij risicovolle patronen detecteren, escaleren en delen, terwijl onderzoekers duidelijkheid nodig hebben over legitieme toegang.","winners":"Aanbieders van gecontroleerde onderzoeksomgevingen, identity- en access-management, biologische screening en onafhankelijke evaluatie krijgen een grotere rol.","losers":"Open toegang zonder contextcontrole komt onder druk te staan; legitieme biologen kunnen tegelijk last krijgen van false positives en extra verificatie.","overlooked":"De grootste informatiekloof zit in denominatoren: vijf geblokkeerde casussen zeggen weinig over totaal legitiem gebruik, gemiste pogingen of de daadwerkelijke extra capaciteit die het model toevoegde.","horizons":{"short":"De komende maanden ligt de aandacht op technische details, onafhankelijke evaluaties en incidentinformatie.","medium":"Binnen één tot twee jaar ligt gelaagde toegang voor high-end biologische AI voor de hand.","long":"Als modellen experimentele planning sterk versnellen, verschuift biosecurity naar gecombineerde controle van modellen, synthese-infrastructuur en experimentketens."},"counterScenario":"De vijf casussen kunnen vooral voorbeelden zijn van bekende dual-use informatie waarbij Claude weinig extra vermogen toevoegde. Dan is het rapport vooral een signaal over monitoring en intentie.","watch":["Technische onderbouwing van de vijf bio-casussen","Onafhankelijke metingen van biologische capability uplift","Nieuwe toegangsprogramma’s voor professionele biologie"],"sources":[{"kind":"Onafhankelijk","label":"Reuters — Anthropic disrupts bioweapons research efforts, 10 september 2026","url":"https://www.reuters.com/legal/litigation/anthropic-disrupts-russian-chinese-ai-campaigns-targeting-its-claude-models-2026-09-10/"},{"kind":"Onafhankelijk","label":"Associated Press — Anthropic blocked potentially dangerous biological misuse, 11 september 2026","url":"https://apnews.com/article/00266dca90e4f8853f669648998d3bda"},{"kind":"Primair","label":"Anthropic — Why do we take LLMs seriously as a potential source of biorisk?","url":"https://www.anthropic.com/research/biorisk"}]},"analyses":[{"section":"Agenten & infrastructuur","title":"De agent-harness wordt een clouddienst in plaats van een zelfgebouwd onderdeel","intro":"OpenAI lanceerde op 10 september de Agents API in publieke bèta voor langlopende agenten, context, tools en subagenten.","facts":["OpenAI zegt dat de Agents API dezelfde soort harness-infrastructuur gebruikt die Codex aandrijft.","De API ondersteunt OpenAI-hosted sandboxes, eigen infrastructuur en partneromgevingen, plus MCP en functies."],"analysis":["De concurrentielaag verschuift van modelkwaliteit naar orchestration: contextbeheer, herstel, toolselectie en veilige uitvoering.","Een beheerde harness verlaagt ontwikkelwerk, maar vergroot afhankelijkheid van één leverancier voor gedrag dat voorheen in applicatiecode zat."],"impact":"Voor softwareteams kan agentinfrastructuur sneller commoditiseren; betrouwbaarheid, audit en herstel worden daardoor belangrijker dan alleen een werkende demo.","horizons":{"short":"Teams vergelijken eigen orchestrators met beheerde agent-API’s.","medium":"Observability en policy enforcement worden standaardonderdelen van agentplatforms.","long":"Standaarden kunnen model- en infrastructuurkeuze modulairder maken, anders neemt lock-in toe."},"counterScenario":"Grote bedrijven kunnen hun eigen orchestratie blijven onderhouden als beheerde harnesses onvoldoende controle bieden.","watch":["SLA’s, prijzen en incidentrapportage"],"sources":[{"kind":"Primair","label":"OpenAI — Introducing the Agents API, 10 september 2026","url":"https://openai.com/index/introducing-the-agents-api/"}]},{"section":"Enterprise data","title":"De Data agent maakt semantiek en toegangsbeheer belangrijker dan de chatinterface","intro":"OpenAI introduceerde een Data agent voor ChatGPT Work die bedrijfsdata kan onderzoeken en interactieve dashboards kan bouwen.","facts":["OpenAI noemt koppelingen met onder meer Redshift, BigQuery, Databricks, MongoDB en Snowflake.","Volgens OpenAI worden bestaande rechten op tabel-, rij- en kolomniveau afgedwongen via verbonden accounts."],"analysis":["De bottleneck verschuift van SQL schrijven naar betrouwbare definities van metrics, relaties en bevoegdheden.","Self-service analytics kan wachttijd verlagen, maar verhoogt ook het aantal mensen dat analyses kan publiceren."],"impact":"Data- en BI-teams krijgen waarschijnlijk minder routinematige queryverzoeken en meer verantwoordelijkheid voor definities, kwaliteit, lineage en evaluatie.","horizons":{"short":"Bedrijven starten met afgebakende datasets.","medium":"Semantische lagen en agent-evaluaties worden kerninfrastructuur.","long":"Analytics kan van aparte applicatiecategorie naar ingebedde agentfunctie verschuiven."},"counterScenario":"Bij onvoldoende vertrouwen of te complexe governance blijft de agent vooral een interface boven bestaande BI-tools.","watch":["Foutpercentages op complexe bedrijfsmetrics"],"sources":[{"kind":"Primair","label":"OpenAI — Now everyone can put data to work, 10 september 2026","url":"https://openai.com/index/put-data-to-work/"}]},{"section":"Zorg & regulering","title":"Het VK wil AI-zorgtoezicht van toelatingsmoment naar volledige levenscyclus verplaatsen","intro":"De Britse National Commission into the Regulation of AI in Healthcare publiceerde aanbevelingen voor proportionele, levenscyclusgerichte regulering.","facts":["De commissie is een onafhankelijke, niet-wettelijke adviescommissie die door de